[08/13 02:17:20] d2.data.datasets.coco WARNING: 
Category ids in annotations are not in [1, #categories]! We'll apply a mapping for you.

[08/13 02:17:20] d2.data.datasets.coco INFO: Loaded 496 images in COCO format from ./data/egoism-hoi-dataset/annotations/test_coco.json
[08/13 02:17:20] d2.data.common INFO: Serializing 496 elements to byte tensors and concatenating them all ...
[08/13 02:17:20] d2.data.common INFO: Serialized dataset takes 3.63 MiB
[08/13 02:17:20] d2.evaluation.coco_evaluation INFO: Fast COCO eval is not built. Falling back to official COCO eval.
[08/13 02:17:21] d2.evaluation.evaluator INFO: Start inference on 496 batches
[08/13 02:17:23] d2.evaluation.evaluator INFO: Inference done 11/496. Dataloading: 0.0033 s/iter. Inference: 0.1273 s/iter. Eval: 0.0026 s/iter. Total: 0.1333 s/iter. ETA=0:01:04
[08/13 02:17:29] d2.evaluation.evaluator INFO: Inference done 52/496. Dataloading: 0.0044 s/iter. Inference: 0.1175 s/iter. Eval: 0.0045 s/iter. Total: 0.1265 s/iter. ETA=0:00:56
[08/13 02:17:34] d2.evaluation.evaluator INFO: Inference done 95/496. Dataloading: 0.0049 s/iter. Inference: 0.1139 s/iter. Eval: 0.0037 s/iter. Total: 0.1226 s/iter. ETA=0:00:49
[08/13 02:17:39] d2.evaluation.evaluator INFO: Inference done 138/496. Dataloading: 0.0045 s/iter. Inference: 0.1124 s/iter. Eval: 0.0036 s/iter. Total: 0.1206 s/iter. ETA=0:00:43
[08/13 02:17:44] d2.evaluation.evaluator INFO: Inference done 182/496. Dataloading: 0.0045 s/iter. Inference: 0.1109 s/iter. Eval: 0.0038 s/iter. Total: 0.1194 s/iter. ETA=0:00:37
[08/13 02:17:49] d2.evaluation.evaluator INFO: Inference done 224/496. Dataloading: 0.0046 s/iter. Inference: 0.1110 s/iter. Eval: 0.0039 s/iter. Total: 0.1196 s/iter. ETA=0:00:32
[08/13 02:17:54] d2.evaluation.evaluator INFO: Inference done 268/496. Dataloading: 0.0045 s/iter. Inference: 0.1103 s/iter. Eval: 0.0038 s/iter. Total: 0.1187 s/iter. ETA=0:00:27
[08/13 02:17:59] d2.evaluation.evaluator INFO: Inference done 315/496. Dataloading: 0.0045 s/iter. Inference: 0.1087 s/iter. Eval: 0.0039 s/iter. Total: 0.1171 s/iter. ETA=0:00:21
[08/13 02:18:04] d2.evaluation.evaluator INFO: Inference done 359/496. Dataloading: 0.0046 s/iter. Inference: 0.1082 s/iter. Eval: 0.0040 s/iter. Total: 0.1168 s/iter. ETA=0:00:16
[08/13 02:18:09] d2.evaluation.evaluator INFO: Inference done 401/496. Dataloading: 0.0047 s/iter. Inference: 0.1084 s/iter. Eval: 0.0040 s/iter. Total: 0.1171 s/iter. ETA=0:00:11
[08/13 02:18:14] d2.evaluation.evaluator INFO: Inference done 447/496. Dataloading: 0.0046 s/iter. Inference: 0.1077 s/iter. Eval: 0.0040 s/iter. Total: 0.1163 s/iter. ETA=0:00:05
[08/13 02:18:19] d2.evaluation.evaluator INFO: Inference done 494/496. Dataloading: 0.0045 s/iter. Inference: 0.1069 s/iter. Eval: 0.0040 s/iter. Total: 0.1155 s/iter. ETA=0:00:00
[08/13 02:18:19] d2.evaluation.evaluator INFO: Total inference time: 0:00:56.674236 (0.115426 s / iter per device, on 1 devices)
[08/13 02:18:19] d2.evaluation.evaluator INFO: Total inference pure compute time: 0:00:52 (0.106748 s / iter per device, on 1 devices)
[08/13 02:18:19] d2.evaluation.coco_evaluation INFO: Preparing results for COCO format...
[08/13 02:18:19] d2.evaluation.coco_evaluation INFO: Saving results to ./weights/383__33_lf/inference/test/coco_instances_results.json
[08/13 02:18:19] d2.evaluation.coco_evaluation INFO: Evaluating predictions with official COCO API...
[08/13 02:18:19] d2.evaluation.coco_evaluation INFO: Evaluating a_ehoi_core for task: bbox
[08/13 02:18:21] d2.evaluation.coco_evaluation INFO: Evaluation results for bbox: 
|   AP   |  AP50  |  AP75  |  APs   |  APm   |  APl   |
|:------:|:------:|:------:|:------:|:------:|:------:|
| 66.666 | 85.145 | 78.363 | 36.698 | 73.026 | 75.079 |
[08/13 02:18:21] d2.evaluation.coco_evaluation INFO: Per-category bbox AP: 
| category             | AP     | category               | AP     | category                     | AP     |
|:---------------------|:-------|:-----------------------|:-------|:-----------------------------|:-------|
| power supply         | 64.744 | oscilloscope           | 78.681 | welder station               | 80.183 |
| electric screwdriver | 55.306 | screwdriver            | 49.662 | pliers                       | 54.255 |
| welder probe tip     | 53.143 | oscilloscope probe tip | 53.380 | low voltage board            | 71.580 |
| high voltage board   | 49.686 | register               | 76.768 | electric screwdriver battery | 68.384 |
| working area         | 59.217 | welder base            | 69.258 | socket                       | 73.246 |
| left red button      | 74.900 | left green button      | 80.562 | right red button             | 75.840 |
| right green button   | 78.761 | hand                   | 65.760 |                              |        |
[08/13 02:18:34] detectron2 INFO: 


[08/13 02:18:34] detectron2 INFO: ============================== EVALUATION RESULTS ==============================
[08/13 02:18:34] detectron2 INFO: 

--- [ Task: Standard Object Detection (COCOEvaluator) ] ---
[08/13 02:18:34] detectron2 INFO: AP                                  : 66.67
[08/13 02:18:34] detectron2 INFO: AP50                                : 85.15
[08/13 02:18:34] detectron2 INFO: AP75                                : 78.36
[08/13 02:18:34] detectron2 INFO: APs                                 : 36.70
[08/13 02:18:34] detectron2 INFO: APm                                 : 73.03
[08/13 02:18:34] detectron2 INFO: APl                                 : 75.08
[08/13 02:18:34] detectron2 INFO: AP-power supply                     : 64.74
[08/13 02:18:34] detectron2 INFO: AP-oscilloscope                     : 78.68
[08/13 02:18:34] detectron2 INFO: AP-welder station                   : 80.18
[08/13 02:18:34] detectron2 INFO: AP-electric screwdriver             : 55.31
[08/13 02:18:34] detectron2 INFO: AP-screwdriver                      : 49.66
[08/13 02:18:34] detectron2 INFO: AP-pliers                           : 54.25
[08/13 02:18:34] detectron2 INFO: AP-welder probe tip                 : 53.14
[08/13 02:18:34] detectron2 INFO: AP-oscilloscope probe tip           : 53.38
[08/13 02:18:34] detectron2 INFO: AP-low voltage board                : 71.58
[08/13 02:18:34] detectron2 INFO: AP-high voltage board               : 49.69
[08/13 02:18:34] detectron2 INFO: AP-register                         : 76.77
[08/13 02:18:34] detectron2 INFO: AP-electric screwdriver battery     : 68.38
[08/13 02:18:34] detectron2 INFO: AP-working area                     : 59.22
[08/13 02:18:34] detectron2 INFO: AP-welder base                      : 69.26
[08/13 02:18:34] detectron2 INFO: AP-socket                           : 73.25
[08/13 02:18:34] detectron2 INFO: AP-left red button                  : 74.90
[08/13 02:18:34] detectron2 INFO: AP-left green button                : 80.56
[08/13 02:18:34] detectron2 INFO: AP-right red button                 : 75.84
[08/13 02:18:34] detectron2 INFO: AP-right green button               : 78.76
[08/13 02:18:34] detectron2 INFO: AP-hand                             : 65.76
[08/13 02:18:34] detectron2 INFO: 

--- [ Task: Egocentric HOI Evaluation (EHOIEvaluator) ] ---
[08/13 02:18:34] detectron2 INFO: AP Hand                             : 96.84
[08/13 02:18:34] detectron2 INFO: mAP Objects                         : 84.53
[08/13 02:18:34] detectron2 INFO: mAP Target Objects                  : 0.00
[08/13 02:18:34] detectron2 INFO: AP Hand + Side                      : 94.14
[08/13 02:18:34] detectron2 INFO: AP Hand + State                     : 72.81
[08/13 02:18:34] detectron2 INFO: mAP Hand + State                    : 45.81
[08/13 02:18:34] detectron2 INFO: mAP Hand + Target Objects           : 42.02
[08/13 02:18:34] detectron2 INFO: power supply                        : 15.84
[08/13 02:18:34] detectron2 INFO: oscilloscope                        : 55.85
[08/13 02:18:34] detectron2 INFO: welder station                      : 45.38
[08/13 02:18:34] detectron2 INFO: electric screwdriver                : 30.64
[08/13 02:18:34] detectron2 INFO: screwdriver                         : 28.82
[08/13 02:18:34] detectron2 INFO: pliers                              : 43.73
[08/13 02:18:34] detectron2 INFO: welder probe tip                    : 15.08
[08/13 02:18:34] detectron2 INFO: oscilloscope probe tip              : 23.34
[08/13 02:18:34] detectron2 INFO: low voltage board                   : 48.36
[08/13 02:18:34] detectron2 INFO: high voltage board                  : 19.95
[08/13 02:18:34] detectron2 INFO: register                            : 68.33
[08/13 02:18:34] detectron2 INFO: electric screwdriver battery        : 14.85
[08/13 02:18:34] detectron2 INFO: working area                        : 22.44
[08/13 02:18:34] detectron2 INFO: welder base                         : 54.06
[08/13 02:18:34] detectron2 INFO: socket                              : 79.47
[08/13 02:18:34] detectron2 INFO: left red button                     : 53.92
[08/13 02:18:34] detectron2 INFO: left green button                   : 57.55
[08/13 02:18:34] detectron2 INFO: right red button                    : 24.53
[08/13 02:18:34] detectron2 INFO: right green button                  : 86.63
[08/13 02:18:34] detectron2 INFO: AP All                              : 50.50
[08/13 02:18:34] detectron2 INFO: mAP All                             : 41.51
[08/13 02:18:34] detectron2 INFO: 
================================================================================
MMEhoiNetv1 PERFORMANCE SUMMARY
================================================================================
+------------------------------+------------+
| Metric                       |  Score (%) |
+------------------------------+------------+
| Object Detection (mAP)       |     66.67 |
| Hand Detection (AP)          |     65.76 |
| Target Object (mAP)          |      0.00 |
| Hand Side (AP)               |     94.14 |
| Contact State (AP)           |     72.81 |
| Overall HOI (mAP All)        |     41.51 |
+------------------------------+------------+
[08/15 19:54:31] d2.data.datasets.coco WARNING: 
Category ids in annotations are not in [1, #categories]! We'll apply a mapping for you.

[08/15 19:54:31] d2.data.datasets.coco INFO: Loaded 496 images in COCO format from ./data/egoism-hoi-dataset/annotations/test_coco.json
[08/15 19:54:31] d2.data.common INFO: Serializing 496 elements to byte tensors and concatenating them all ...
[08/15 19:54:31] d2.data.common INFO: Serialized dataset takes 3.63 MiB
[08/15 19:54:31] d2.evaluation.coco_evaluation INFO: Fast COCO eval is not built. Falling back to official COCO eval.
[08/15 19:54:33] d2.evaluation.evaluator INFO: Start inference on 496 batches
[08/15 19:54:37] d2.evaluation.evaluator INFO: Inference done 11/496. Dataloading: 0.0045 s/iter. Inference: 0.2324 s/iter. Eval: 0.0041 s/iter. Total: 0.2410 s/iter. ETA=0:01:56
[08/15 19:54:42] d2.evaluation.evaluator INFO: Inference done 35/496. Dataloading: 0.0048 s/iter. Inference: 0.2093 s/iter. Eval: 0.0045 s/iter. Total: 0.2187 s/iter. ETA=0:01:40
[08/15 19:54:47] d2.evaluation.evaluator INFO: Inference done 62/496. Dataloading: 0.0046 s/iter. Inference: 0.1979 s/iter. Eval: 0.0050 s/iter. Total: 0.2077 s/iter. ETA=0:01:30
[08/15 19:54:52] d2.evaluation.evaluator INFO: Inference done 88/496. Dataloading: 0.0047 s/iter. Inference: 0.1943 s/iter. Eval: 0.0050 s/iter. Total: 0.2042 s/iter. ETA=0:01:23
[08/15 19:54:57] d2.evaluation.evaluator INFO: Inference done 114/496. Dataloading: 0.0046 s/iter. Inference: 0.1911 s/iter. Eval: 0.0055 s/iter. Total: 0.2014 s/iter. ETA=0:01:16
[08/15 19:55:03] d2.evaluation.evaluator INFO: Inference done 153/496. Dataloading: 0.0046 s/iter. Inference: 0.1734 s/iter. Eval: 0.0055 s/iter. Total: 0.1837 s/iter. ETA=0:01:03
[08/15 19:55:08] d2.evaluation.evaluator INFO: Inference done 183/496. Dataloading: 0.0044 s/iter. Inference: 0.1717 s/iter. Eval: 0.0056 s/iter. Total: 0.1818 s/iter. ETA=0:00:56
[08/15 19:55:13] d2.evaluation.evaluator INFO: Inference done 210/496. Dataloading: 0.0046 s/iter. Inference: 0.1728 s/iter. Eval: 0.0058 s/iter. Total: 0.1832 s/iter. ETA=0:00:52
[08/15 19:55:18] d2.evaluation.evaluator INFO: Inference done 231/496. Dataloading: 0.0046 s/iter. Inference: 0.1782 s/iter. Eval: 0.0059 s/iter. Total: 0.1887 s/iter. ETA=0:00:50
[08/15 19:55:23] d2.evaluation.evaluator INFO: Inference done 254/496. Dataloading: 0.0047 s/iter. Inference: 0.1821 s/iter. Eval: 0.0060 s/iter. Total: 0.1929 s/iter. ETA=0:00:46
[08/15 19:55:28] d2.evaluation.evaluator INFO: Inference done 275/496. Dataloading: 0.0049 s/iter. Inference: 0.1854 s/iter. Eval: 0.0062 s/iter. Total: 0.1965 s/iter. ETA=0:00:43
[08/15 19:55:34] d2.evaluation.evaluator INFO: Inference done 296/496. Dataloading: 0.0049 s/iter. Inference: 0.1888 s/iter. Eval: 0.0063 s/iter. Total: 0.2000 s/iter. ETA=0:00:40
[08/15 19:55:39] d2.evaluation.evaluator INFO: Inference done 317/496. Dataloading: 0.0047 s/iter. Inference: 0.1917 s/iter. Eval: 0.0063 s/iter. Total: 0.2029 s/iter. ETA=0:00:36
[08/15 19:55:44] d2.evaluation.evaluator INFO: Inference done 337/496. Dataloading: 0.0048 s/iter. Inference: 0.1946 s/iter. Eval: 0.0063 s/iter. Total: 0.2058 s/iter. ETA=0:00:32
[08/15 19:55:49] d2.evaluation.evaluator INFO: Inference done 358/496. Dataloading: 0.0047 s/iter. Inference: 0.1968 s/iter. Eval: 0.0062 s/iter. Total: 0.2078 s/iter. ETA=0:00:28
[08/15 19:55:54] d2.evaluation.evaluator INFO: Inference done 379/496. Dataloading: 0.0048 s/iter. Inference: 0.1990 s/iter. Eval: 0.0062 s/iter. Total: 0.2101 s/iter. ETA=0:00:24
[08/15 19:55:59] d2.evaluation.evaluator INFO: Inference done 402/496. Dataloading: 0.0048 s/iter. Inference: 0.1994 s/iter. Eval: 0.0064 s/iter. Total: 0.2106 s/iter. ETA=0:00:19
[08/15 19:56:04] d2.evaluation.evaluator INFO: Inference done 424/496. Dataloading: 0.0049 s/iter. Inference: 0.2005 s/iter. Eval: 0.0063 s/iter. Total: 0.2118 s/iter. ETA=0:00:15
[08/15 19:56:09] d2.evaluation.evaluator INFO: Inference done 445/496. Dataloading: 0.0048 s/iter. Inference: 0.2022 s/iter. Eval: 0.0064 s/iter. Total: 0.2135 s/iter. ETA=0:00:10
[08/15 19:56:14] d2.evaluation.evaluator INFO: Inference done 464/496. Dataloading: 0.0048 s/iter. Inference: 0.2045 s/iter. Eval: 0.0065 s/iter. Total: 0.2159 s/iter. ETA=0:00:06
[08/15 19:56:20] d2.evaluation.evaluator INFO: Inference done 488/496. Dataloading: 0.0048 s/iter. Inference: 0.2046 s/iter. Eval: 0.0066 s/iter. Total: 0.2161 s/iter. ETA=0:00:01
[08/15 19:56:21] d2.evaluation.evaluator INFO: Total inference time: 0:01:45.928797 (0.215741 s / iter per device, on 1 devices)
[08/15 19:56:21] d2.evaluation.evaluator INFO: Total inference pure compute time: 0:01:40 (0.204099 s / iter per device, on 1 devices)
[08/15 19:56:21] d2.evaluation.coco_evaluation INFO: Preparing results for COCO format...
[08/15 19:56:21] d2.evaluation.coco_evaluation INFO: Saving results to weights/383__33_lf/inference/test/coco_instances_results.json
[08/15 19:56:21] d2.evaluation.coco_evaluation INFO: Evaluating predictions with official COCO API...
[08/15 19:56:21] d2.evaluation.coco_evaluation INFO: Evaluating a_ehoi_core for task: bbox
[08/15 19:56:23] d2.evaluation.coco_evaluation INFO: Evaluation results for bbox: 
|   AP   |  AP50  |  AP75  |  APs   |  APm   |  APl   |
|:------:|:------:|:------:|:------:|:------:|:------:|
| 66.666 | 85.145 | 78.363 | 36.698 | 73.026 | 75.079 |
[08/15 19:56:23] d2.evaluation.coco_evaluation INFO: Per-category bbox AP: 
| category             | AP     | category               | AP     | category                     | AP     |
|:---------------------|:-------|:-----------------------|:-------|:-----------------------------|:-------|
| power supply         | 64.744 | oscilloscope           | 78.681 | welder station               | 80.183 |
| electric screwdriver | 55.306 | screwdriver            | 49.662 | pliers                       | 54.255 |
| welder probe tip     | 53.143 | oscilloscope probe tip | 53.380 | low voltage board            | 71.580 |
| high voltage board   | 49.686 | register               | 76.768 | electric screwdriver battery | 68.384 |
| working area         | 59.217 | welder base            | 69.258 | socket                       | 73.246 |
| left red button      | 74.900 | left green button      | 80.562 | right red button             | 75.840 |
| right green button   | 78.761 | hand                   | 65.760 |                              |        |
[08/15 19:56:42] detectron2 INFO: 


[08/15 19:56:42] detectron2 INFO: ============================== EVALUATION RESULTS ==============================
[08/15 19:56:42] detectron2 INFO: 

--- [ Task: Standard Object Detection (COCOEvaluator) ] ---
[08/15 19:56:42] detectron2 INFO: AP                                  : 66.67
[08/15 19:56:42] detectron2 INFO: AP50                                : 85.15
[08/15 19:56:42] detectron2 INFO: AP75                                : 78.36
[08/15 19:56:42] detectron2 INFO: APs                                 : 36.70
[08/15 19:56:42] detectron2 INFO: APm                                 : 73.03
[08/15 19:56:42] detectron2 INFO: APl                                 : 75.08
[08/15 19:56:42] detectron2 INFO: AP-power supply                     : 64.74
[08/15 19:56:42] detectron2 INFO: AP-oscilloscope                     : 78.68
[08/15 19:56:42] detectron2 INFO: AP-welder station                   : 80.18
[08/15 19:56:42] detectron2 INFO: AP-electric screwdriver             : 55.31
[08/15 19:56:42] detectron2 INFO: AP-screwdriver                      : 49.66
[08/15 19:56:42] detectron2 INFO: AP-pliers                           : 54.25
[08/15 19:56:42] detectron2 INFO: AP-welder probe tip                 : 53.14
[08/15 19:56:42] detectron2 INFO: AP-oscilloscope probe tip           : 53.38
[08/15 19:56:42] detectron2 INFO: AP-low voltage board                : 71.58
[08/15 19:56:42] detectron2 INFO: AP-high voltage board               : 49.69
[08/15 19:56:42] detectron2 INFO: AP-register                         : 76.77
[08/15 19:56:42] detectron2 INFO: AP-electric screwdriver battery     : 68.38
[08/15 19:56:42] detectron2 INFO: AP-working area                     : 59.22
[08/15 19:56:42] detectron2 INFO: AP-welder base                      : 69.26
[08/15 19:56:42] detectron2 INFO: AP-socket                           : 73.25
[08/15 19:56:42] detectron2 INFO: AP-left red button                  : 74.90
[08/15 19:56:42] detectron2 INFO: AP-left green button                : 80.56
[08/15 19:56:42] detectron2 INFO: AP-right red button                 : 75.84
[08/15 19:56:42] detectron2 INFO: AP-right green button               : 78.76
[08/15 19:56:42] detectron2 INFO: AP-hand                             : 65.76
[08/15 19:56:42] detectron2 INFO: 

--- [ Task: Egocentric HOI Evaluation (EHOIEvaluator) ] ---
[08/15 19:56:42] detectron2 INFO: AP Hand                             : 95.11
[08/15 19:56:42] detectron2 INFO: mAP Objects                         : 75.63
[08/15 19:56:42] detectron2 INFO: mAP Target Objects                  : 0.00
[08/15 19:56:42] detectron2 INFO: AP Hand + Side                      : 94.14
[08/15 19:56:42] detectron2 INFO: AP Hand + State                     : 72.81
[08/15 19:56:42] detectron2 INFO: mAP Hand + State                    : 45.81
[08/15 19:56:42] detectron2 INFO: mAP Hand + Target Objects           : 42.02
[08/15 19:56:42] detectron2 INFO: power supply                        : 15.84
[08/15 19:56:42] detectron2 INFO: oscilloscope                        : 55.85
[08/15 19:56:42] detectron2 INFO: welder station                      : 45.38
[08/15 19:56:42] detectron2 INFO: electric screwdriver                : 30.64
[08/15 19:56:42] detectron2 INFO: screwdriver                         : 28.82
[08/15 19:56:42] detectron2 INFO: pliers                              : 43.73
[08/15 19:56:42] detectron2 INFO: welder probe tip                    : 15.08
[08/15 19:56:42] detectron2 INFO: oscilloscope probe tip              : 23.34
[08/15 19:56:42] detectron2 INFO: low voltage board                   : 48.36
[08/15 19:56:42] detectron2 INFO: high voltage board                  : 19.95
[08/15 19:56:42] detectron2 INFO: register                            : 68.33
[08/15 19:56:42] detectron2 INFO: electric screwdriver battery        : 14.85
[08/15 19:56:42] detectron2 INFO: working area                        : 22.44
[08/15 19:56:42] detectron2 INFO: welder base                         : 54.06
[08/15 19:56:42] detectron2 INFO: socket                              : 79.47
[08/15 19:56:42] detectron2 INFO: left red button                     : 53.92
[08/15 19:56:42] detectron2 INFO: left green button                   : 57.55
[08/15 19:56:42] detectron2 INFO: right red button                    : 24.53
[08/15 19:56:42] detectron2 INFO: right green button                  : 86.63
[08/15 19:56:42] detectron2 INFO: AP All                              : 50.50
[08/15 19:56:42] detectron2 INFO: mAP All                             : 41.51
[08/15 19:56:42] detectron2 INFO: 
================================================================================
MMEhoiNetv1 PERFORMANCE SUMMARY
================================================================================
+------------------------------+------------+
| Metric                       |  Score (%) |
+------------------------------+------------+
| Object Detection (mAP)       |     66.67 |
| Hand Detection (AP)          |     65.76 |
| Target Object (mAP)          |      0.00 |
| Hand Side (AP)               |     94.14 |
| Contact State (AP)           |     72.81 |
| Overall HOI (mAP All)        |     41.51 |
+------------------------------+------------+
